{
  "$schema": "./schemas/conventions-schema.json",
  "version": "1.0.0",
  "generated_at": "2024-01-15T08:00:00Z",

  "naming": {
    "files": {
      "components": {
        "pattern": "PascalCase",
        "extension": ".tsx",
        "examples": ["UserProfile.tsx", "DashboardCard.tsx"],
        "confidence": 0.95
      },
      "hooks": {
        "pattern": "camelCase",
        "prefix": "use",
        "extension": ".ts",
        "examples": ["useAuth.ts", "useLocalStorage.ts"],
        "confidence": 0.98
      },
      "utilities": {
        "pattern": "camelCase",
        "extension": ".ts",
        "examples": ["formatDate.ts", "validateEmail.ts"],
        "confidence": 0.88
      },
      "types": {
        "pattern": "camelCase",
        "extension": ".ts",
        "examples": ["user.ts", "apiTypes.ts"],
        "confidence": 0.82
      },
      "tests": {
        "pattern": "match-source",
        "suffix": ".test",
        "examples": ["UserProfile.test.tsx"],
        "confidence": 0.96
      }
    },
    "code": {
      "variables": {
        "pattern": "camelCase",
        "examples": ["userData", "isLoading", "handleClick"],
        "confidence": 0.97
      },
      "constants": {
        "pattern": "UPPER_SNAKE_CASE",
        "examples": ["MAX_RETRIES", "API_BASE_URL"],
        "confidence": 0.92
      },
      "functions": {
        "pattern": "camelCase",
        "examples": ["getUserData", "formatCurrency"],
        "confidence": 0.96
      },
      "components": {
        "pattern": "PascalCase",
        "examples": ["UserProfile", "NavigationMenu"],
        "confidence": 0.99
      },
      "types_interfaces": {
        "pattern": "PascalCase",
        "examples": ["User", "ApiResponse", "FormData"],
        "confidence": 0.94
      }
    }
  },

  "formatting": {
    "indentation": {
      "type": "spaces",
      "size": 2,
      "confidence": 1.0
    },
    "quotes": {
      "style": "single",
      "jsx": "double",
      "confidence": 0.95
    },
    "semicolons": {
      "required": true,
      "confidence": 0.98
    },
    "trailing_commas": {
      "style": "es5",
      "confidence": 0.90
    },
    "line_length": {
      "max": 100,
      "confidence": 0.85
    }
  },

  "imports": {
    "order": [
      { "group": "react", "pattern": "^react" },
      { "group": "next", "pattern": "^next" },
      { "group": "third-party", "pattern": "^[a-z@]" },
      { "group": "local", "pattern": "^[@~/]" },
      { "group": "relative", "pattern": "^\\.\\.?/" },
      { "group": "styles", "pattern": "\\.(css|scss|sass)$" }
    ],
    "style": "named",
    "newline_between_groups": true,
    "confidence": 0.88
  },

  "exports": {
    "style": "named",
    "default_exports": "components_only",
    "barrel_files": true,
    "confidence": 0.86
  },

  "comments": {
    "style": "jsdoc",
    "required_for": ["public_functions", "complex_logic"],
    "format": {
      "single_line": "// comment",
      "multi_line": "/* comment */",
      "doc": "/** @description */"
    },
    "confidence": 0.78
  }
}
